identifiant	nom	appellation	datation/0	commune	departement	insee	code_departement	localisation/lon	localisation/lat	appartient_a	materiau_du_gros_oeuvre	auteur	historique_du_batiment_ou_de_l_oeuvre	description_du_batiment	type_de_protection	chercheur/0	copyright	datation/1	datation/2	chercheur/1
IA85002086	Ponts ferroviaires du Quaireau	pont	3e quart 19e siècle	L'Île-d'Elle	Vendée	85111	85	-0.9557479503161497	46.323974259619504				Les ponts ont été construits en même temps que la ligne La Rochelle/La Roche-sur-Yon, ouverte en 1871. Leur construction a suscité de vives discussions entre l'Etat d'une part, la Société des marais de Vix-Maillezais et celle du Contrebot de Vix, d'autre part, ces dernières soucieuses du bon écoulement de l'eau dans leurs canaux. La forte inondation de l'hiver 1872-1873 semble justifier ces craintes. Interpellé, le Conseil général des Ponts et chausées réfute ces accusations lors de sa séance du 29 mars 1873. A la demande de la Société de Vix-Maillezais, une commission est toutefois constituée sur le sujet et ordonne des aménagements.	Les deux ponts sont situés à l'ouest du hameau du Quaireau, par-dessus le canal de Vix et le Contrebot de Vix. Leurs tabliers droits, aujourd'hui en béton, sont soutenus par des culées en pierre.		Yannis Suire	(c) Région Pays de la Loire - Inventaire général;(c) Conseil départemental de la Vendée			
IA85002082	Passerelle ; Grande levée de Vix	passerelle	limite 19e siècle 20e siècle	L'Île-d'Elle	Vendée	85111	85	-0.9045735244111955	46.32633038704291				Cette passerelle, qui ne figure pas sur le plan cadastral de 1834, a été créée en 1858 pour faciliter les communications entre les marais mouillés, situés au sud, les marais desséchés et le bourg de L'Île-d'Elle, au nord. En effet, venant des bords de Sèvre au sud-est de la commune, on pouvait grâce à cette passerelle accéder à la digue ou Grande levée de Vix puis la suivre vers l'ouest jusqu'à Touvent où un chemin commençait à travers les marais desséchés, vers Soulisse puis le bourg. Une autre passerelle devait prolonger celle-ci au nord, enjambant le canal de Vix, en direction du Grousseau.Le 11 mai 1858, l'assemblée générale de la Société du Contrebot de Vix autorise M. de Bessay et M. Bridault, propriétaires de la ferme du Grousseau, à établir une passerelle en bois par-dessus le Contrebot, pour accéder aux marais mouillés. L'ouvrage aura 18 mètres de long et 1,35 de large. Il sera soutenu par quatre poteaux qui délimiteront une arche de 6 mètres d'ouverture. Cette première passerelle a sans doute été reconstruite au tout début du 20e siècle. La passerelle actuelle a en effet été réalisée selon le même modèle que deux autres jetées en 1904 par-dessus le canal de Vix et le Contrebot entre Touvent et Soulisse, toujours dans le même objectif d'améliorer les communications dans les marais.	La passerelle est située au sud du Grousseau et au nord des Cornardeaux. Elle franchit le Contrebot de Vix. Son tablier est supporté par quatre pieux en bois renforcés de pieux en béton. Le tablier est formé de deux poutres métalliques en arc surbaissé, sur lesquelles sont disposées des traverses en bois et fixés les montants des garde-corps en métal.		Yannis Suire	(c) Région Pays de la Loire - Inventaire général;(c) Conseil départemental de la Vendée			
IA85002059	Ponts du Quaireau, rue des Ponts Neufs	pont	3e quart 19e siècle	L'Île-d'Elle	Vendée	85111	85	-0.9494953835105754	46.324594436245974			Ateliers de Montataire, H. Joret, Paris	"Lorsque le canal de Vix est creusé dans les années 1650, il entraîne une rupture dans l'accès depuis le bourg de L'ïle-d'Elle au marais communal et, plus généralement, à tous les marais situés entre le nouveau canal et la Vieille Sèvre. Les habitants de L'Île-d'Elle s'en émeuvent et, le 12 octobre 1657, ils passent un accord avec la nouvelle Société des marais desséchés de Vix-Maillezais, propriétaire du canal de Vix. En plus d'une indemnité en argent, ils obtiennent la construction et l’entretien aux frais de la Société d’un pont enjambant le nouveau canal afin d’accéder à leur communal. Le pont ne devra toutefois être accessible qu'aux piétons et aux bestiaux. Un second pont devra être construit si le premier n’est pas suffisant. En outre, la Société accepte de ne rien réclamer aux Nellezais si leurs bestiaux vont ""fortuitement"" endommager les bords du canal de Vix. Les Nellezais obtiennent comme autre garantie, de pouvoir pratiquer une ouverture dans la Grande levée de Vix si l’eau inonde l’espace entre la digue et les terres hautes du bourg. Quelques années plus tard, en 1662, lorsque le Contrebot de Vix est à son tour creusé, un second pont est construit au même endroit, dans le prolongement de celui qui enjambe le canal de Vix, toujours pour pouvoir accéder aux marais qui se trouvent au sud.Les deux ponts apparaissent alors sur les différents plans qui se succèdent au cours des siècles, et en particulier sur le plan cadastral de 1834. Le pont sur le canal de Vix est un ouvrage à une seule arche en plein cintre, de 6,18 mètres de diamètre, sous une chaussée à deux pans, sans parapets, comme le précise un plan de 1869. L'entretien des deux ouvrages est régulièrement l'objet de litiges entre la Société de Vix-Maillezais et les habitants de L'Île-d'Elle. En novembre 1753, profitant d'une visite d'experts sur l'état du Contrebot, ces derniers accusent la Société de négliger l'entretien du pont qui enjambe ce canal : dépourvu de parapets, dégarni au point que les pierres de la voûte affleurent, il est tellement étroit que ""deux boeufs attelés ont peine à y passer de front sans risque (...) en telle sorte qu'encore ce matin, il est tombé un boeuf du nommé Cardin, métayer de la métairie de Bellevue"".En 1867, le conseil municipal demande à la Société de Vix-Maillezais l'autorisation de reconstruire celui sur le canal de Vix afin de pouvoir y faire passer non plus seulement des piétons et des bestiaux, comme le stipule l'accord de 1657, mais aussi des véhicules, étant donné l'augmentation de l'activité agricole dans les marais. La municipalité s'engage à effectuer les travaux à ses frais puis à entretenir l'ouvrage, à condition que la Société lui transfère la propriété du pont. La Société donne son accord le 31 août, sous réserve de maintenir la même distance entre les culées du pont pour ne pas entraver l'écoulement de l'eau. Le 27 avril 1869, l'ingénieur ordinaire des Ponts et chaussées Maucher présente un projet de reconstruction du pont. Il comprendra désormais une arche surbaissée et un tablier plat, avec trottoirs et parapets, le tout en pierre de taille des Charentes (et non en fonte, comme un temps envisagé). Approuvés le 15 mai, les travaux sont adjugés le 1er août à André Deschamps, entrepreneur à Marans, qui les achève en décembre. Ils ne sont réceptionnés que le 17 janvier 1871.Peu après, c'est au tour du pont sur le Contrebot d'être reconstruit à la demande de la Société du Contrebot en vue d'en limiter l'entravement. Comprenant jusqu'à présent deux arches, on envisage d'abord d'en créer une troisième, rive gauche, mais en octobre 1872, il est décidé de ne créer qu'une seule arche de 9,82 mètres d'ouverture, de manière à réduire encore plus l'étranglement du canal à cet endroit. Le 16 juillet 1874, le sous-ingénieur des Ponts et chaussées Espitallier (auquel l'on doit aussi les passerelles de Rouillebouc et du Renfermis) présente les plans du nouveau pont. Considérant que, sur ce pont, ""il ne passera jamais de voitures lourdement chargées comme sur une route"", il écarte l'idée d'une chaussée en pierre sur voûtes en briques et propose un simple tablier métallique avec plancher en charpente et trottoirs en encorbellement. Le tablier du nouveau pont sera 50 centimètres plus haut que le précédent. Le coût de l'ouvrage est estimé à 5200 francs, dont 1000 à la charge de la commune. Mais celle-ci s'oppose à la Société du Contrebot sur la question de l'entretien du futur pont. Un accord est passé le 6 juillet 1875, partageant les frais entre les deux parties. En octobre 1876, les travaux sont enfin en cours.En 1931, le pont du Contrebot, vétuste, est à nouveau reconstruit. Le 20 février, le conseil municipal en accepte le principe. Le 23 août, le projet est confié à l'agent-voyer Chaillou qui propose un hourdis en béton à la place de l'ancien tablier métallique, tout en conservant et en restaurant les garde-corps métalliques d'origine. On conserve toutefois le principe de poutres métalliques ; celle en aval porte encore aujourd'hui la marque du fabricant ""Ateliers de Montataire, H. Joret et Cie, Paris"".En 1995, contrairement à ce qu'avait prédit Espitallier en 1874, les ponts s'avèrent trop étroits pour pouvoir absorber la circulation des camions de l'usine voisine et celle des engins agricoles. Les deux ouvrages sont donc délaissés et deux nouveaux ponts en béton sont construits à peine quelques mètres en amont."	Les deux anciens ponts qui enjambent successivement, en venant du nord, le canal de Vix puis le Contrebot de Vix, sont tous les deux des ponts à une seule travée et à tablier droit, en béton, soutenu par des culées en pierre, avec garde-corps en métal. Tous deux mesurent environ 20 mètres de long sur environ 4 de large. Le pont sur le canal de Vix est accompagné, côté aval, sur la rive droite du canal, d'une cale permettant l'accostage des bateaux. Elle présente une rampe inclinée, renforcée par un perré en pierre, avec aussi un quai vertical sur le bord du canal.		Yannis Suire	(c) Région Pays de la Loire - Inventaire général;(c) Conseil départemental de la Vendée			
IA85002058	Pont de Pomère, rue des Ponts Neufs	pont	4e quart 20e siècle	L'Île-d'Elle	Vendée	85111	85	-0.9493323518804381	46.320610769668676	Canal de Pomère			Le creusement du canal de Pomère en 1839 entraîne une coupure dans les marais mouillés de L'Île-d'Elle, tant du point de vue des paysages que de la circulation des biens et des personnes. La nécessité de pouvoir aller d'une rive à l'autre pousse à la construction d'une passerelle mobile par-dessus le barrage construit en 1841 à la tête aval du canal, juste en amont de l'actuelle passerelle de Rouillebouc, 400 mètres en aval du pont actuel. Le barrage lui-même comprend deux travées séparées par une pile en pierre, celle de la rive gauche étant plus courte que celle de la rive droite, soutenue par des poteaux en bois. Sur la rive gauche du canal, une maison est établie à proximité immédiate du barrage, pour loger son gardien.En 1870, décision est prise de remplacer la passerelle mobile par un pont carrossable, jeté sur le barrage qu'on aura surélevé au préalable. L'ingénieur ordinaire des Ponts et chaussées Maucher en dresse le projet le 5 novembre 1870. Le pont comprendra un tablier métallique, des voûtes en brique et une chaussée empierrée. Les travaux sont adjugés le 21 octobre 1871 à André Deschamps, entrepreneur à Marans, et ils sont achevés en 1873. Ils provoquent toutefois un affaissement du barrage et nécessitent des ajustements dès 1875. Ce pont-barrage est régulièrement dénoncé comme un obstacle à la navigation et à l'écoulement de l'eau, notamment les deux poteaux en bois de la travée de droite. Après qu'un bateau les ait heurtés, leur démolition est décidée en 1893, tandis que le tablier métallique du pont, trop lourd, est remplacé par un tablier en bois. Au début du 20e siècle, ce pont s'avère insuffisant et surtout trop court, le canal devant être élargi. Le 3 octobre 1920, le conseil municipal examine et accepte la proposition du Syndicat des marais mouillés de la Vendée de construire un nouveau pont en amont de l'ancien pont-barrage, au droit du pont du Quaireau qui enjambe le Contrebot, avec création d'un chemin entre deux. Ce nouveau pont facilitera l'accès aux marais mouillés situés sur la rive gauche du canal de Pomère et aux fermes et maisons qui s'y trouvent. Le 13 juin 1921, le Bureau technique de l'Ouest, établi à Nantes, présente un projet de pont en béton armé de type Hennebique, à construire 400 mètres en amont de l'ancien pont-barrage. Il comprendra une voie charretière de 2,40 mètres de large, avec trottoirs et garde-corps en béton armé. Des ponts du même type seront aussi construits sur le canal évacuateur (route N137) et au pont de la Loge, à Marans (les ponts de Pomère et celui de la Loge, encore visible de nos jours, seront identiques). Les travaux, adjugés à l'entreprise Coudrais et Robiou du Pont, et réalisés sous la surveillance de M. Jomier, ingénieur en chef des Ponts et chaussées, sont réceptionnés le 22 mai 1924. Il faut toutefois attendre 1926 pour que des rampes d'accès au pont soient construites, par Auguste Braud, entrepreneur à L'Île-d'Elle. Quant à l'ancien pont-barrage de 1841 en aval du nouveau pont, il est démoli en 1924 sauf une partie de son radier, puis totalement en 1926. Au fond du canal, ses fondations ne seront retirées que lors du curage de celui-ci, en 1958.Remplaçant ce premier pont, le pont actuel a été construit en 1998.	Le pont, en béton armé, franchit le canal de Pomère au droit du bourg de L'Île-d'Elle, permettant l'accès aux terres et aux habitations qui se trouvent sur la rive gauche du canal. Il comprend trois travées, s'appuyant sur deux piles, avec un garde-corps en métal.		Yannis Suire	(c) Région Pays de la Loire - Inventaire général;(c) Conseil départemental de la Vendée			
IA85001996	Passerelle du Renfermis ou de la Choletière	passerelle	4e quart 19e siècle	L'Île-d'Elle	Charente-Maritime	85111	17	-0.8932865022658512	46.32300134117441	Passerelle de Rouillebouc			Le projet de passerelle à construire à chacune des deux extrémités du canal de Pomère (dont une à Rouillebouc, entre L'Île-d'Elle et Marans, et l'autre au Renfermis, entre L'Île-d'Elle et Saint-Jean-de-Liversay) est présenté le 10 juillet 1873 par l'ingénieur ordinaire des Ponts et chaussées Espitallier, et approuvé le 11 novembre suivant. Jusqu'à présent, les cours d'eau qui interrompaient le chemin de halage étaient franchis à l'aide de petits bateaux à chaîne, système peu pratique. Les travaux, menés en régie par les Ponts et chaussées, ont lieu en 1875-1876 : les batardeaux pour la passerelle de Rouillbouc sont construits en avril 1875, ceux de la passerelle du Renfermis en août 1876. La partie métallique et la charpente des tabliers sont fournies par Alfred Cayer, serrurier à Niort ; la maçonnerie et la charpente des fondations sont réalisées par Alexis Boutin, de Taugon. Les travaux sont réceptionnés le 31 décembre 1877.	Longue de 43 mètres, la passerelle enjambe le lit de la Vieille Sèvre Niortaise, permettant la continuité du chemin de halage qui longe la rive gauche du canal de Pomère puis de la Sèvre Niortaise. Le tablier, en bois goudronné, possède un garde-corps métallique. L'ensemble repose sur deux culées et quatre piles en pierre de taille, reliées par une charpente en métal. Deux rampes prolongent la passerelle sur les deux rives.		Yannis Suire	(c) Région Pays de la Loire - Inventaire général;(c) Conseil départemental de la Vendée			
IA85001961	Ponts (2) de Sainte-Radegonde	pont	1ère moitié 19e siècle	Sainte-Radégonde-des-Noyers	Vendée	85267	85	-1.0543827446357679	46.37327392740861				Le pont figure sur la carte de la région par Claude Masse, en 1701, puis sur le plan cadastral de 1834. La première indique qu'il permet le franchissement d'un chemin reliant Sainte-Radégonde-des-Noyers au Petit Sableau, à travers les marais desséchés, axe qui n'apparaît pas ni sur la carte de Cassini, au milieu du 18e siècle, ni sur le plan cadastral, et que la carte d'état-major, au début du 19e siècle, reporte (par erreur ?) au nord. Sur ces documents, le pont ne sert qu'à traverser le canal du Clain, pour relier ses deux rives longées par des chemins. La route D25 allant vers l'est n'a été créée qu'à la fin du 19e siècle. Le pont lui-même, tel qu'il se présente aujourd'hui, a pu être construit dans la première moitié du 19e siècle.En 1954, pour faciliter la circulation sur la route D25 et éviter l'angle droit formé par la route et le pont, il est décidé de construire un nouveau pont en amont de l'ancien. Les plans en sont établis le 29 juillet 1954 par M. Texier, ingénieur TPE des Ponts et chaussées. Le nouveau pont comprend des culées en maçonnerie fondées sur le rocher calcaire, un tablier en béton armé, et des garde-corps en tubes d'acier. Pour faciliter le passage du bac dévaseur de la Société des marais du Petit-Poitou dans le canal du Clain, les culées seront prolongées par des murs en ailes.	Le pont le plus ancien, le plus en aval, perpendiculaire au canal, est une construction à une seule arche, en moellons, avec arc et parapets en pierre de taille. Le pont le plus récent, en amont de l'autre, croise le canal de manière oblique. Il possède un tablier droit en béton, des culées en moellons et un garde-corps en métal.		Yannis Suire	(c) Région Pays de la Loire - Inventaire général;(c) Conseil départemental de la Vendée	milieu 20e siècle		
IA85001933	Passage par bac puis pont mobile du Brault	pont mobile	4e quart 20e siècle	Sainte-Radégonde-des-Noyers	Charente-Maritime	85267	17	-1.0827901085850309	46.31689456880908				"Le Brault constitue, depuis le Moyen Age, un point de franchissement de la Sèvre Niortaise privilégié entre Bas-Poitou et Aunis, notamment pour le commerce des récoltes issues des marais desséchés environnants. Pourtant, de part et d'autre, les voies d'accès à travers les marais depuis La Rochelle et Charron d'une part, Luçon et Puyravault de l'autre, ne sont pas aisées. Le passage lui-même, en bateau voire à gué (à la saison sèche seulement), a mauvaise réputation. En septembre 1469, c'est pourtant au passage du Brault que le roi Louis XI rencontre son frère, Charles, duc de Guyenne, alors en guerre contre lui. La réconciliation a lieu sur un pont de bateaux construit pour l'occasion, ""à l'endroit du chastel de Charon, on lieu que l'on dit le pont du Bron"". Enfin, en 1484, les précomptes des seigneuries de l'île de Ré et de Marans mentionnent parmi les redevances celle due sur ""le passaige du Berault, nouvellement ediffié par le seigneur de Charon"".Au XVIe siècle, plusieurs témoins rapportent les difficultés à franchir le passage du Brault : Antoine Bernard, dans sa Chronique du Langon, explique qu'en 1568, des troupes ""s'en allèrent jusqu'à Marans par le passage du Braud, dont les aucuns étoient fort mouillés et embrisés jusqu'aux fesses, car le Braud n'est en ce temps assez propre pour passer"" ; en 1569, La Popelinière précise que ""pour aller au bourg de Marans, après estre passé le bourg de Champagné, on trouve un grand canal d'eau de mer qu'on nomme le passage du Berauld, qui est large, profond et si vaseux qu'on n'y peut passer à pied ne à cheval"". En 1579, ""la Beraude"" est indiquée sur la carte du Poitou par Pierre Rogier. En ces temps de guerres de Religion, Marans est défendu par une série de fortins, dont l'un se situe au passage du Brault, verrouillant l'entrée de la Sèvre Niortaise. Ce ""fort ruiné"" est mentionné en 1701 sur une carte de la région par Claude Masse.Choisi comme site d'aboutissement de la plupart des grands canaux de dessèchement du Marais poitevin au Moyen Age puis au XVIIe siècle, le Brault demeure sous l'Ancien Régime un lieu de passage important, d'autant que l'autre axe entre Bas-Poitou et Aunis, via Sérigny, Marans, la rivière Vendée et Le Poiré-sur-Velluire, est lui-même peu aisé d'utilisation. Dans les années 1640, la construction du canal de Vienne et de la digue ou ""bot"" qui le longe, permet d'améliorer l'accès au passage du Brault, grâce au chemin qui emprunte cette digue. Au-delà de l'embouchure du canal de Vienne, l'itinéraire se prolonge vers le sud, à l'ouest de l'anse du Brault, en empruntant les premières encablures de la digue du Vieux desséché de Champagné (entre les actuels lieux-dits Saint-André et le Brault).Les cartes de la région par Claude Masse, en 1701 et 1704, qualifient ce tronçon de ""chemin de Luçon ou du Bas Poitou"". Il aboutit au bord de la Sèvre, là où se trouve aujourd'hui le pont mobile édifié en 1977. Une fois traversé la Sèvre, le voyageur trouve, sur l'autre rive, les ruines de l'ancien fort du Brault, et le ""chemin de La Rochelle ou du Brau"" qui, comme sur l'autre rive, emprunte une digue, jusqu'aux terres hautes de Charron. L'itinéraire est repris dans la seconde moitié du XVIIIe siècle sur la carte de Cassini. Il est alors pourtant relativement sur le déclin, avec la construction de la route royale entre Nantes et La Rochelle, via Marans, et d'autant que la dangerosité du passage par bac du Brault reste un handicap. Claude Masse le souligne dès 1705, indiquant, de manière prémonitoire, qu'il ""n’y a point de remède à moins que d’y faire un pont de charpente brisée par le milieu pour laisser passer les bâtiments qui remontent la Sèvre"".Après la Révolution, la gestion du passage du Brault, par un bac, est confiée par l'Etat à un passagier. Le passage du Brault figure sur la carte du bassin de la Sèvre Niortaise par Mesnager, en 1818, avec un bâtiment sur la rive gauche, côté Charron. Le plan cadastral de Charron, en 1820, et celui de Sainte-Radégonde-des-Noyers, en 1834, indiquent que le passage se trouve à la jonction entre les deux portions de la route de La Rochelle à Luçon. Un plan de 1872 montre les installations du passage (maison du passagier, appontements, cale d'embarquement), juste en amont du pont actuel (là où se trouvent encore une construction et des appontements). Divers aménagements sont ponctuellement apportés au passage et à ses équipements, par exemple la construction d'un nouvel abri, en dur, pour le passagier, en 1848 ; ou la reconstruction du bac, par Louis Mahé, entrepreneur, en 1858. La propriété du bac est transférée par l'Etat au Département de la Charente-Inférieure en 1871.La dangerosité du passage et son caractère aléatoire poussent régulièrement les autorités locales à demander des aménagements, voire la construction d'un pont, comme cela est envisagé dès 1828. Le 8 novembre 1868, à la suite d'un accident qui a coûté la vie à deux personnes, la municipalité de Charron réclame le remplacement du bac par un pont tournant, considérant par ailleurs que l'absence d'un tel ouvrage nuit au développement de la mytiliculture et au commerce des moules.  Cette demande est à son tour rejetée par l'Etat.La question revient sur le devant de la scène dans les années 1880-1890, notamment après l'ouverture du canal de Marans à la mer. Une réflexion plus poussée, menée à partir de 1897, aboutit en 1912-1915 (seulement) à la construction d'un nouvel axe routier reliant la Vendée et la Charente-Maritime, en contournant par l'est le vieux passage par bac. La nouvelle route forme une grande boucle vers l'est, en franchissant les portes des canaux et l'écluse du canal de Marans à la mer, puis un nouveau pont mobile en béton.Après 1945, l'augmentation du trafic routier oblige à envisager l'abandon du pont mobile et la construction d'un nouvel ouvrage plus adapté. Le site de l'ancien passage par bac, délaissé depuis le début du XXe siècle, est dès lors réinvesti pour construire un nouveau pont mobile, bien plus long et large que son prédécesseur. L'ouvrage voit le jour en 1977.Quant aux anciens bâtiments qui accompagnaient le passage par bac jusqu'en 1915, ils évoluent encore au XXe siècle, avec notamment la construction d'une maison dans les années 1950 à la place de l'ancien logement du passagier. Cette maison est démolie peu après 2010, dans le cadre de la procédure des zones dites danger extrême ou ""zones noires"" qui a suivi la tempête Xynthia. De même est démolie une maison de la seconde moitié du XIXe siècle ou du début du XXe, qui se trouvait au sud du site."	Le pont mobile constitue le point de franchissement de la Sèvre Niortaise le plus à l'ouest et le plus proche de l'embouchure du fleuve. Il se situe à la jonction entre la route D9 qui vient de la Charente-Maritime, au sud ; et la route D10A, en Vendée, au nord. Le pont, en béton armé, est constitué de trois travées droites. La travée centrale, mobile, est formée d'un tablier en métal qui se soulève par effet de bascule, les contre-poids se trouvant sur la rive gauche. De part et d'autre du pont, en amont et en aval, quatre piles en béton indiquent aux bateaux la voie d'accès à la travée centrale.En amont du pont, rive gauche, commune de Charron, le site de l'ancien passage par bac est encore occupé par une construction (2e moitié du 20e siècle) et par des appontements en bois, héritiers de ceux qui existaient à l'époque du passage par bac.		Yannis Suire	(c) Région Pays de la Loire - Inventaire général;(c) Conseil départemental de la Vendée			
