identifiant	nom	appellation	datation/0	commune	departement	insee	code_departement	localisation/lon	localisation/lat	appartient_a	materiau_du_gros_oeuvre	auteur	historique_du_batiment_ou_de_l_oeuvre	description_du_batiment	type_de_protection	chercheur/0	copyright	datation/1	datation/2	chercheur/1
IA85002383	Pont dit le pont du Petit Bot	pont	4e quart 19e siècle	Vix	Vendée	85303	85	-0.8508667746881616	46.36824994100556	Vix : présentation de la commune			"Le 26 juin 1696, la Société des marais desséchés de Vix décide de construire ""un petit pontreau de cinq à six pieds de large pour facliter l'entrée et passage de Vix dans les marais de Boisdieu et Maillezais et des derrières de Vix"". Il s'agit probablement du pont du Petit Bot. Le pont est situé sur ce qui, jusqu'en 1865 et la construction de la route D 20, constituait le seul chemin reliant Vix et Doix à travers les marais desséchés. L'itinéraire apparaît sur le plan cadastral de 1836, avec à cet endroit une différence par rapport à aujourd'hui. A cette époque en effet, le chemin suivait le coude formé ici par la route d'eau puis franchissait celle-ci, en formant un autre coude, par un pont situé un peu plus au sud-est que le pont actuel (le parcellaire des terrains voisins a conservé la forme de cet ancien franchissement). Le chemin a été rectifié, et ces coudes successifs supprimés, en 1862, selon le cadastre.Le pont est reconstruit à la même occasion mais semble rester dans un premier temps à son emplacement initial : le conseil municipal du 21 juin 1863 précise que le chantier, confié à MM. Bourgoin et Mignonneau, sera achevé d'ici juillet. Ce n'est qu'en 1879, semble-t-il, que le pont est déplacé sur le nouvel itinéraire du chemin de Vix à Doix, et donc reconstruit. Le 2 mars, le conseil municipal indique que le terrain nécessaire à la construction du pont du Petit Bot sur le chemin de Vix à Doix a été acheté. La date 1891 est cependant inscrite sur le parapet nord du pont (angle ouest). Elle pourrait se rapporter à la construction du pont, ou bien être un simple graffiti réalisé postérieurement."	"Le pont est situé sur le chemin du Petit Bot qui relie le bourg de Vix aux marais situés au nord, jusqu'au canal du Pont aux chèvres. Le pont franchit la route d'eau du Petit Bot, un des cours d'eau qui serpente encore dans ces marais remembrés. L'ouvrage, en pierre de taille, présente une architecture similaire à celle du pont aux Chèvres. Il possède une seule arche en plein cintre, avec claveau réguliers, sous deux parapets droits. L'assise de chaque parapet est marquée par un large bandeau. Des inscriptions, le plus souvent incomplètes ou illisibles, ainsi que quelques graffitis, également lacunaires, sont visibles sur les parapets. On lit toutefois, sur le parapet nord, la date 1891, les initiales BP au-dessus d'une croix de Lorraine (inscrites à l'occasion de la Libération en 1944 ?), le surnom ""Labonette"" ou encore le nom de famille Tardy."		Yannis Suire	(c) Région Pays de la Loire - Inventaire général;(c) Conseil départemental de la Vendée			
IA85002382	Pont dit le pont Bailey ; île de Charouin	pont	4e quart 20e siècle	Vix	Vendée	85303	85	-0.8579662511340088	46.33027748714921	Vix : présentation de la commune			Le remembrement des marais de l'île de Charouin peu avant 1970, le développement de l'agriculture qu'il y entraîne et la nécessité d'y accéder plus facilement, entraîne la construction de ce pont. Il s'agit d'un ouvrage de type Bailey, pont préfabriqué portatif mis au point en 1941 pour un usage militaire par Donald Bailey, ingénieur américain. Ce type de pont fut très utilisé par les forces alliées pendant la Seconde Guerre mondiale, notamment en Normandie en juin 1944, et l'est encore de nos jours par l'armée française.Dès 1968, la commune de Vix sollicite le ministère de l'Equipement pour obtenir un pont de type Bailey, afin de desservir les terres nouvellement mises en valeur de l'île de Charouin. Autorisée par de la service de la navigation des Deux-Sèvres le 9 janvier 1970, la construction du pont intervient en décembre suivant, réalisée par l'entreprise de travaux publics Grimaud frères, de Bouillé-Courdault. Si le pont est gratuitement mis à disposition par l'Etat, la construction les pieux de fondations et des rampes d'accès ainsi que les frais d'installation sont pris en charge par la commune.	Le pont traverse le canal du Sablon pour accéder à l'île de Charouin. Long de 68 mètres et large de 4,5, il prend appui sur des terre-pleins en terre et, au milieu, sur deux piles en béton. Sur la rive droite du canal, il franchit le chemin de halage avant de traverser le canal lui-même. Comme tous les ponts de type Bailey, conçus pour un montage rapide et facile, le pont est en acier à poutres latérales, avec platelage en bois et de hauts garde-corps doubles, en acier également.		Yannis Suire	(c) Région Pays de la Loire - Inventaire général;(c) Conseil départemental de la Vendée			
IA85002371	Passerelle de halage ; île de Charouin	passerelle	2e moitié 19e siècle	Vix	Vendée	85303	85	-0.8547286605812132	46.33104888102735	Canal du Sablon			Cette passerelle a dû être créée dans la seconde moitié du 19e siècle, lors de l'aménagement du chemin de halage longeant le canal du Sablon. L'ouvrage actuel a sans doute été (re)construit à la fin du 20e siècle.	La passerelle, en partie en ruines, est située sur l'itinéraire de l'ancien chemin de halage qui longeait le canal du Sablon sur sa rive gauche. Elle enjambe un large fossé qui relie la Sèvre Niortaise à l'ancienne ferme des Brûlis située en arrière. Construite en béton armé, elle comprend un tablier droit soutenu par deux piles et prolongé par des rampes.		Yannis Suire	(c) Région Pays de la Loire - Inventaire général;(c) Conseil départemental de la Vendée	4e quart 20e siècle		
IA85002360	Passerelle de halage ; île de Charouin	passerelle	4e quart 19e siècle	Vix	Vendée	85303	85	-0.8603766850203027	46.324214382047494	Vix : présentation de la commune			"A la fin du 19e siècle, la municipalité de Vix cherche le moyen de faciliter l'accès aux très nombreuses petites parcelles qui composent l'île de Charouin depuis plus d'un siècle. Elle constate que les fossés qui les séparent sont souvent petits et sinueux, ce qui ne facilite pas l'évacuation de l'eau et entrave la circulation des bateaux. En 1892, décision est donc prise de creuser un fossé ""de dessèchement et de navigation"" à travers l'île et ses marais, en prenant soin de créer des passerelles de halage à ses extrémités.Les plans du projet sont présentés par les Ponts et Chaussées le 9 novembre 1892, mais leur approbation par déclaration d'utilité publique puis par arrêté préfectoral n'intervient que les 12 juin et 12 septembre 1895, en raison des difficultés d'acquisition des nombreux terrains nécessaires. Le projet précise que chaque passerelle sera formée de deux culées en maçonnerie laissant entre elles une largeur libre de 5 mètres. Elles supporteront un tablier métallique avec platelage en bois de 1,30 mètre de largeur, muni d’un garde-corps seulement du côté opposé à la rivière. La charpente métallique du tablier sera composée de deux poutrelles en fer double T, reliées entre elles par six entretoises en fer cornière. Le dessus des culées sera raccordé avec le chemin de halage par des rampes inclinées. Il sera aménagé dans chaque culée, en dehors du tablier, un coulisseau pouvant recevoir des poutrelles destinées à former une retenue en cas d’une inondation passagère. Tout l’ouvrage reposera sur un radier général établi sur un grillage en bois de pin noyé dans le béton. Les travaux de creusement du fossé et de construction des passerelles sont adjugés le 20 octobre 1895."	La passerelle se situe sur la rive droite de la Vieille Sèvre Niortaise, dans les marais de l'île de Charouin. Elle enjambe le canal qui traverse l'île et qui sépare aujourd'hui sa partie nord, remembrée, de sa partie sud, en réserve naturelle. Une autre passerelle identique se trouvait à l'origine à la tête amont du canal. La passerelle, en ruines, comprend encore ses deux culées en pierre de taille et une partie de son tablier en fonte, en arc segmentaire.		Yannis Suire	(c) Région Pays de la Loire - Inventaire général;(c) Conseil départemental de la Vendée			
IA85002352	Ponts (3) dits le pont de Vix ; le Pont de Vix	pont	18e siècle	Vix	Vendée	85303	85	-0.8293733909048766	46.344647793355435	Vix : présentation de la commune			Les ponts de Vix, destinés à faciliter l'accès depuis les terres hautes à la digue ou Grande levée de Vix, mais aussi aux marais mouillés qui s'étendent au-delà, au sud, ne sont pas mentionnés sur le plan de partage des marais desséchés de Vix-Maillezais en 1663 (au contraire, par exemple, des ponts du Quaireau, à L'Île-d'Elle, établis dans le même objectif). En revanche, le pont de Vix est bien indiqué sur le plan des mêmes marais desséchés établi par A. de La Maisonneuve en 1678. Et les ponts de Vix sont portés sur la carte des environs par Claude Masse en 1720, puis sur le plan cadastral de 1836. Les ponts de Vix sont alors au nombre de deux seulement, soit les deux ponts nord actuels. Ils permettent de franchir le Petit canal de la Société et le canal de Vix pour rejoindre la Grande levée de Vix et les maisons ou huttes qui s'y trouvent. Ces deux ponts, encore en place de nos jours, ont pu être construits au 18e siècle ou au début du 19e.Le troisième pont, au sud, le plus grand, par-dessus le Contrebot de Vix, n'est construit qu'en 1856 lorsque la route pour rejoindre le passage (futur pont) du Sablon, en direction de Taugon, est tracée à travers les marais mouillés. La construction du pont sur le Contrebot est confiée le 9 août 1856 par la commune de Vix à Pierre Prosper Sauvaget, entrepreneur à Fontenay-le-Comte ; les travaux d'empierrement du nouveau chemin sont adjugés le 23 janvier 1858, et la plantation de peupliers, de frênes et de saules le long de l'itinéraire est décidée par le conseil municipal en 1860. Le pont de 1856 est connu par une photographie de Jules Robuchon, sans doute prise peu après. Elle montre l'ouvrage qui ne présente alors qu'un tablier droit en bois, avec trois pertuis séparés par des piles en pierre, et reposant sur des culées également en pierre.Le 26 février 1885, le conseil municipal constate que le pont menace ruine, notamment son tablier. Il a fallu limiter le poids des charges pouvant passer dessus, ce qui gêne les échanges de marchandises. Le conseil décide alors de reconstruire le pont, en demandant une subvention au département. C'est à cette occasion que le pont actuel, entièrement en pierre et avec arches, a dû remplacer le premier pont en bois de 1856. Les garde-corps des trois ponts ont alors dû être harmonisés mais il semble bien (au vu de l'architecture des ouvrages) que l'on ait conservé les deux ponts nord, paraissant plus anciens que le grand pont sud.Régulièrement, l'inondation vient lécher les arches et les piles du ponts, notamment à l'hiver 1935-1936, comme le rappelle une marque sur la culée nord du pont, côté aval. En 1964, lorsque le Petit canal de la Société a été supprimé, on a conservé les deux petits ponts nord ainsi que le morceau de digue sur lequel ils reposent et qui séparait ce canal du canal de Vix.	Les trois ponts enjambent successivement, du nord au sud, le Petit canal de la Société, le canal de Vix et le Contrebot de Vix, assurant ainsi la continuité entre les terres hautes de Vix, via la rue du Pont de Vix, et les marais qui se trouvent au sud, via la route D25b qui se dirige vers la Sèvre Niortaise, Taugon et la Charente-Maritime. Construits en pierre de taille, les ponts ont en commun leurs garde-corps, en fonte, en forme de croisillons. Ils se différencient ensuite par leur taille et leur maçonnerie. Les deux ponts au nord (sans doute plus anciens) ne possèdent en effet qu'une seule arche en plein cintre chacun, et leur maçonnerie paraît moins régulière que pour le troisième pont. Celui-ci, au sud, présente trois arches en arc segmentaire, retombant sur des piles également en pierre, avec des claveaux et des assises de pierre bien plus réguliers.		Yannis Suire	(c) Région Pays de la Loire - Inventaire général;(c) Conseil départemental de la Vendée			
IA85002342	Ponts (3) dit les ponts de la Bijettrie ; la Bijettrie	pont	2e quart 20e siècle	Vix	Vendée	85303	85	-0.869101374540026	46.33062788167561	Vix : présentation de la commune			"Jusqu'au milieu du 20e siècle, les fermes de la Bijettrie et de Drapelle ne sont pas reliées au bourg de Vix par voie terrestre. Le moyen le plus facile de rejoindre le bourg depuis les marais est alors d'emprunter la Grande levée de Vix et le canal de Vix puis, par bateau, le canal du Pont aux chèvres jusqu'au village du même nom, et de là le bourg. Le plan cadastral de 1836 montre qu'à l'emplacement des ponts actuels, sur la Grande levée de Vix, s'élevait une ""hutte"", la hutte à Guérin, habitation d'un des nombreux huttiers chargés par la Société des marais de Vix-Maillezais de surveiller la digue. Cette hutte a été démolie en 1931. Une autre hutte, la ""hutte à Guéret"" se trouvait en amont. Elle appartenait en 1836 à François Guéret (1779-1852), huttier, veuf de Marie Augereau. Cette hutte a disparu en 1953.Le projet de construction du chemin de la Bijettrie entre Montnommé et les fermes de la Bijettrie est engagé en 1939 mais il ne reçoit un début d'exécution qu'en 1941. Il entraîne la nécessité, pour rallier Drapelle via un sentier, de franchir, du nord au sud, le Petit canal de la Société, le canal de Vix et le Contrebot de Vix. Or, dès 1936, on établit une passerelle par-dessus le Contrebot. La construction de ce petit ouvrage (encore visible de nos jours) est confiée le 28 mars 1936 par la municipalité à Gustave Grimaud, entrepreneur à Bouillé-Courdault, ""inventaire des pieux à vis en béton armé"" grâce auxquels l'ouvrage, lui-même en béton armé, avec garde-corps métallique, sera fiché dans la vase. Mais la passerelle montre très vite des défauts de conception et construction. Malgré ses pieux à vis fichés dans le sol argileux, elle s'enfonce jusqu'à ce que son tablier touche le bord du canal !Débutée en 1941 mais interrompue par la guerre, la construction du chemin de la Bijettrie reprend en 1946 et est achevée en 1948. La passerelle sur le Contrebot, en plus de sa fragilité, s'avère trop petite. Son remplacement par un pont, la construction de deux autres sur le Petit canal de la Société et sur le canal de Vix, et le prolongement du chemin jusqu'à Drapelle sont décidés par le conseil municipal le 4 décembre 1949. Les travaux commencent en juin 1950 mais sont interrompus par l'inondation de décembre 1950 et janvier 1951. L'entrepreneur chargé de l'opération, M. Cornet est autorisé à prolonger le chantier. Le 7 juin 1953, enfin, une fête nautique est organisée à Drapelle pour l'inauguration des ponts et du chemin, en collaboration avec le Moteur Yacht Club. En 1964, lorsque le Petit canal de la Société est supprimé, on conserve le pont nord qui l'enjambait, avec au-dessous un morceau qui l'ancienne digue qui séparait ce canal du canal de Vix."	Au débouché de la route de Vix-Montnommé à Drapelle (ou chemin de la Bijettrie), trois ponts permettent d'accéder aux marais mouillés depuis les marais desséchés. Ils franchissent successivement, du nord au sud, le Petit canal de la Société et sa digue (dont il ne reste ici que des morceaux de part et d'autre du premier pont), le canal de Vix, la Grande levée de Vix et le Contrebot de Vix. Les trois ponts ont en commun la forme (en croisillons) et la couleur (verte) de leurs garde-corps, en fonte. Chaque pont comprend un tablier droit en béton, soutenu par quatre piles également en béton reliées latéralement par des croisillons. En amont du pont sur le Contrebot de Vix, se trouve encore une des anciennes passerelles en béton qui, avant la construction des ponts, permettaient l'accès aux marais mouillés depuis le chemin venant de Montnommé. Construite sur des pieux à vis, cette passerelle s'est enfoncée dans le sol peu après sa construction.		Yannis Suire	(c) Région Pays de la Loire - Inventaire général;(c) Conseil départemental de la Vendée	3e quart 20e siècle		
IA85002341	Pont ; le Petit Thairé, route D938 ter	pont	1er quart 19e siècle	Vix	Vendée	85303	85	-0.8780595730440452	46.348429311305914	Vix : présentation de la commune			Le pont a probablement été construit en même temps que la route D938 ter, ancienne route stratégique de Saumur à La Rochelle, tracée en 1834-1835. Il se trouve sur l'ancien itinéraire de cette voie, redressé en 1978.	Le pont permet à la route départementale d'enjamber le canal de la Grange, un des principaux canaux de dessèchement des marais de Vix et du Gué-de-Velluire. Construit en pierre de taille, il comprend une seule arche avec arc en plein cintre et à claveaux réguliers.		Yannis Suire	(c) Région Pays de la Loire - Inventaire général;(c) Conseil départemental de la Vendée			
IA85002327	Pont de la Touchantée ; le Pont aux chèvres, rue du canal, rue du Sablon	pont	2e quart 20e siècle	Vix	Vendée	85303	85	-0.8496974098780451	46.35477570013058	Vix : présentation de la commune		Théophile Loriou	"Le pont aux Chèvres est longtemps resté le seul moyen de franchir le canal du même nom. Sur le plan cadastral de 1836 encore, aucune passerelle ou pont n'apparaît à cet endroit, seulement ce qui ressemble à un petit port ou cale, située comme aujourd'hui en amont du point de jonction entre le canal et la rue de la Touchantée. C'est pour faciliter la communication d'une rive à l'autre du canal, alors que le nombre d'habitants et d'exploitants agricoles augmente dans le quartier, qu'il est d'abord décidé de construire une simple passerelle piétonne. C'est chose faite en 1886 et, le 8 octobre, un arrêté du maire ""défend de laisser circuler les animaux sur les passerelles du Bourbia [ou de la Foutaise] et de la Touchantée nouvellement établie pour les piétons"".La passerelle est remplacée par un pont charretier en 1933. Sa construction est confiée à Théophile (ou Auguste) Loriou, époux de Blanche Loriou, entrepreneur de maçonnerie demeurant près de là, 40 rue du Pont aux chèvres. L'entrepreneur ""Loriou-Chabirand"" a présenté les plans de l'ouvrage le 4 octobre 1932, et le marché a été passé avec la municipalité le 15 décembre. Le projet prévoit la construction d'un pont à tablier unique, en béton armé, avec culées en maçonnerie, selon le procédé Hennebique de l'Agence de l'Ouest, siégeant à Nantes. L'entrepreneur a laissé son nom (""A. LORIOU"") et la date de construction (1933) inscrits sur le tablier du pont, côté amont."	Le pont enjambe le canal du Pont aux chèvres au débouché de la rue de la Touchantée. Il comprend une seule travée, avec tablier plat en béton et garde-corps en fonte. Les culées sont en pierre.		Yannis Suire	(c) Région Pays de la Loire - Inventaire général;(c) Conseil départemental de la Vendée			
IA85002306	Pont dit le pont aux Chèvres	pont	3e quart 19e siècle	Vix	Vendée	85303	85	-0.8483938846045934	46.35657487129051	Canal du Pont aux chèvres			"L'origine du pont est difficile à établir. La tradition orale veut qu'il tienne son nom des premiers êtres vivants qui l'aient franchi après sa construction. Si le canal qu'il enjambe n'a été creusé qu'à la fin du 17e siècle, il semble qu'il existait là un trou ou fosse, selon le témoignage de Françoise Moinet épouse Audineau, habitante de Vix, en 1760. Cette fosse devait être franchie par un pont comme semble l'indiquer un acte notarié du 28 juin 1652 portant partages de biens de René Revillaud, époux de Marie Fonteniou : parmi ces biens se trouvent une motte et bois au lieu ""du pont aux chèvres"".Le pont est toutefois reconstruit au moment du creusement du canal, en 1696. Le 26 juin, devant l'assemblée générale de la Société des marais de Vix-Maillezais, le directeur indique qu'on a commencé à travailler au canal et qu'il faudra ""faire faire le pont à neuf (...), et pour faire lequel pont ledit sieur directeur, en présence du caissier et commis, étant au bourg de Vix, le douze de ce mois, a fait marché avec Charles Dupuy, Pierre Bernard et Pierre Paillé, maçons et tailleurs de pierres (...). Ledit pont aura neuf pieds d'ouverture, les murailles de quatre pieds d'épaisseur et la voûte élevée de neuf pieds, et sera de douze pieds de longueur et douze pieds de largeur, avec un bon pavé au-dessus de la voûte, et des garde-fous aux deux côtés"". A l'assemblée suivante, le 13 octobre 1696, on indique que le pont est achevé.Bien plus tard, le pont apparaît sur le plan cadastral de 1836. En 1865, la réfection et l'allongement vers Maillé de la route D25 entraînent un accroissement de la circulation sur le pont. Le conseil municipal du 26 juillet 1871 constate que le pont est dans un état déplorable. Sa reconstruction, urgente, est dès lors nécessaire. Elle n'est pourtant réalisée qu'à la fin du printemps 1874 : les 28 et 29 avril, les commissaires de la Société des marais de Vix-Maillezais indiquent dans leur rapport annuel que ces travaux vont avoir lieu ""d'ici peu de jours"". La Société a obtenu à cette occasion un élargissement de 50 centimètres du débouché du pont, pour faciliter l'écoulement de l'eau. Cette largeur (4,5 mètres au total) sera la même que celle du barrage établi en 1871 en aval du pont pour, si nécessaire, retenir l'eau en amont à la saison sèche. Dans le même temps, l'abreuvoir en amont du pont est lui aussi reconstruit, suivant décision du conseil municipal du 6 janvier 1874.En septembre 1953, le conseil municipal décide d'installer une pompe électrique à proximité du pont, pour que chacun puisse puiser de l'eau dans le canal, l'ancien puits qui se trouve en aval n'étant plus suffisant. A noter que les parapets du pont ont été surélevés d'une assise de pierre en 2018, avant le passage du Tour de France cycliste."	"Le pont se situe à l'intersection entre la route départementale D25, rue du Pont aux chèvres, et le canal qui porte aussi son nom et qu'il permet de franchir. Le pont, probablement en moellons revêtus de pierre de taille, possède une seule arche. Un bandeau marque le niveau du tablier, sous un parapet en pierre de taille. Ce parapet est ponctué de graffiti sans doute réalisés par des riverains. On reconnaît un char d'assaut avec son canon et différents personnages. L'un d'eux, une femme coiffée de la coiffe traditionnelle des marais de Vix (la ""cabanière""), le menton proéminent, tient un verre qu'elle porte à la bouche.En aval du pont, sur la rive gauche du canal, se trouve un ancien lavoir. Deux glissières en pierre de taille étaient destinées à recevoir un batardeau, en cas de besoin. Un peu plus loin, rive droite, se trouve un ancien puits commun, couvert d'un édicule en pierre de taille (18e siècle ?). L'entrée de cet édicule est en plein cintre, avec jambages chanfreinés et clé de linteau."		Yannis Suire	(c) Région Pays de la Loire - Inventaire général;(c) Conseil départemental de la Vendée			
IA85002129	Passerelles de halage (2) ; chemin de Halage de la Vendée	passerelle	19e siècle	L'Île-d'Elle	Vendée	85111	85	-0.9451731294766633	46.33548161484084				"Ces passerelles, sans doute construites au 19e siècle, font partie de celles, nombreuses, qui permettaient au chemin de halage le long de la rivière Vendée de franchir la foule de cours d'eau qui, perpendiculaires à la rivière, la reliaient aux habitations du bourg de L'Île-d'Elle. La plupart de ces passerelles ont disparu lors du comblement de ces cours d'eau, dans les années 1950-1960. La passerelle au nord du bourg, près de la Ridelière, franchit un cours d'eau plus important que les autres, appelé la Route, une de ces ""routes d'eau"" qui traversaient les marais mouillés au nord de la commune."	Les deux passerelles sont situées au nord du bourg, sur le chemin de halage qui borde la rivière Vendée. L'une se trouve au niveau du 49 rue Nationale, l'autre au lieu-dit la Ridelière. Elles sont construites sur le même modèle. Enjambant un petit cours d'eau qui se jette dans la rivière Vendée, chacune comprend deux culées en pierre de taille, reliées par un tablier en bois. La passerelle nord a toutefois perdu son tablier ; celui de la passerelle sud a été restauré.		Yannis Suire	(c) Région Pays de la Loire - Inventaire général;(c) Conseil départemental de la Vendée			
