identifiant	nom	appellation	datation/0	commune	departement	insee	code_departement	localisation/lon	localisation/lat	appartient_a	materiau_du_gros_oeuvre	auteur	historique_du_batiment_ou_de_l_oeuvre	description_du_batiment	type_de_protection	chercheur/0	copyright	datation/1	datation/2	chercheur/1
IA85001926	Pont de la Courbe	pont	4e quart 18e siècle	Sainte-Radégonde-des-Noyers	Vendée	85267	85	-1.0374090046134687	46.409250077038706				Le pont a probablement été construit en même temps que la route Nantes-La Rochelle qui le franchit, à la fin du 18e siècle. Il présente une architecture similaire à celle du pont de pierre de Marans, édifié sur le même axe en 1782. Le pont tient probablement son nom de la courbe qu'effectue la route à cet endroit. Le parapet du pont a pu être repris au 19e siècle.	Le pont permet à la route D137 de franchir le canal du Clain. Il se trouve au nord-ouest de Chaillé-les-Marais, à la frontière entre cette commune et celle de Sainte-Radégonde-des-Noyers. Construit en moellons et pierre de taille, le pont est encadré par des bajoyers qui renforcent ses abords. Le pont lui-même présente une seule arche, surbaissée, avec claveaux en pierre de taille. Un bandeau souligne le parapet, en moellons et chaînage en pierre de taille. L'ouvrage mesure 17 mètres de long (bajoyers compris ; 8 mètres pour le pont seul) et 13 de large.		Yannis Suire	(c) Région Pays de la Loire - Inventaire général;(c) Conseil départemental de la Vendée			
IA85001905	Pont du Temple	pont	17e siècle	Puyravault	Vendée	85185	85	-1.0738810965041448	46.37763824118633	Puyravault : présentation de la commune			Ce pont était, jusqu'au 19e siècle au moins, doublé par un autre, appelé le Vieux pont du Temple, qui se trouvait en amont, face à la grange-étable de la ferme du Grand Temple. Il permettait de relier celle-ci à la ferme du Petit Temple qui se trouvait sur l'autre rive du canal du Temple. Ces ponts ont dû être créés au moment du creusement de ce canal et du dessèchement des marais du Commandeur, au 13e siècle. Mentionnés sur la carte de la région par Claude Masse en 1701, les deux ponts apparaissent sur le plan cadastral de 1834. L'ouvrage actuel a pu être construit au 17e siècle, au moment du recreusement du canal.	Le pont est situé à la limite entre les communes de Puyravault et de Sainte-Radégonde-des-Noyers, sur le canal du Temple. Construit en moellons équarris (sauf les parapets, en pierre de taille), il comprend une seule arche.		Yannis Suire	(c) Région Pays de la Loire - Inventaire général;(c) Conseil départemental de la Vendée			
IA85001885	Pont, rue Galerne	pont	4e quart 18e siècle	Puyravault	Vendée	85185	85	-1.0900609000670156	46.374885768032655	Puyravault : présentation de la commune			"La date de construction du pont actuel n'est pas déterminée. Il peut remonter à la fin du 18e siècle ou au début du 19e. Le pont existe en tout cas probablement depuis le creusement du canal de Vienne au milieu du 17e siècle. Il figure sur une carte de la région par Claude Masse en 1701. Le plan cadastral de 1834 le dénomme ""Grand pont"". Le pont a perdu son parapet en pierre vers le milieu du 20e siècle."	Le pont est situé à l'ouest du bourg de Puyravault. Il permet à la route départementale D25 de franchir le canal de Vienne. Construit en pierre de taille, le pont comprend une seule arche avec arc en plein cintre et à claveaux réguliers. En aval du pont, sur la rive gauche du canal, se trouve un ancien abreuvoir.		Yannis Suire	(c) Région Pays de la Loire - Inventaire général;(c) Conseil départemental de la Vendée	1er quart 19e siècle		
IA85001807	Pont à Didot, Route départementale n° 50	pont	limite 18e siècle 19e siècle	Luçon	Vendée	85128	85	-1.1466009295024742	46.43727382473116	Luçon, présentation du territoire communal			Le premier pont, datant de la fin du XVIIIe siècle ou du début du XIXe, était en bois. En 1827, les garde-corps furent réparés. La reconstruction de l'ouvrage est entreprise en 1860.	Le pont à Didot est un pont routier permettant de franchir le canal des Hollandais, sur la route allant de Luçon à Champagné-les-Marais. C'est un ouvrage en pierre de taille de calcaire, comportant deux arches voutées en berceau, avec une pile centrale. Son utilité est double ; d'une part, il est nécessaire à la circulation au sein du marais, d'autre part, il facilite l'écoulement des eaux du marais mouillé en direction du canal de Luçon.		Marie-Thérèse Réau	(c) Région Pays de la Loire - Inventaire général			
IA85000942	Pont mobile du Brault (ancien)	pont mobile	1er quart 20e siècle	Sainte-Radégonde-des-Noyers	Vendée	85267	85	-1.0589370756148195	46.37752218249948				"A la fin du XIXe siècle, les autorités se plaignent de plus en plus du caractère aléatoire et dangereux de l'antique passage par bac du Brault. Le Conseil général de la Vendée et celui de la Charente-Inférieure tentent alors de s'entendre pour construire un pont mobile, en lieu et place du passage par bac. Un premier projet est émis en 1878, mais il n'aboutit pas, faute d'accord entre les parties. La question est régulièrement reposée dans les années 1880-1890 en raison de la dangerosité et du caractère aléatoire du passage par bac. Le 3 février 1897, une commission interdépartementale constituée sur le sujet décide le lancement d'études de financement. On hésite encore sur l'emplacement du pont par rapport à la nouvelle écluse du canal de Marans à la mer, ouverte en 1888, pour ne pas gêner le passage des bateaux. Sous la pression des autorités de Marans notamment, il est décidé en 1898 de placer le futur pont près de l'écluse mais en amont de son débouché dans la Sèvre Niortaise. En 1903, on envisage la construction d'un pont transbordeur, comme au Martrou, près de Rochefort.La liaison doit en tout cas parachever un nouvel axe routier devant relier la Vendée et la Charente-Maritime, en contournant le vieux passage par bac du Brault. La nouvelle route, qui formera une grande boucle vers l'est, prendra naissance entre le passage du Brault et Bourg-Chapon, suivra une ligne droite à travers les marais, franchira les canaux de dessèchement et l'écluse du canal de Marans à la mer, et rejoindra la rive de la Sèvre Niortaise quelques centaines de mètres au nord-ouest. Sur l'autre rive, une nouvelle chaussée sera également créée en ligne droite à travers les marais, pour rejoindre l'ancienne route au sud de la ferme de Saint-André. Un pont en béton devra être jeté d'une rive à l'autre ; son tablier sera mobile de manière à pouvoir s'ouvrir pour laisser passer les bateaux.Le 2 mai 1905, les deux départements s'entendent sur un plan de financement par moitié. Les plans du futur ouvrage sont présentés le 16 mars 1906 par le Bureau technique de l'Ouest, exploitant les brevets Hennebique. Le dossier technique est finalisé le 11 avril suivant par l'ingénieur ordinaire des Ponts et chaussées Lombard. Le pont, en béton armé, ""à l'épreuve du feu"", aura une ouverture totale de 105,5 mètres, dont 93 pour la partie fixe. Le pont tournant sera en acier, pour une longueur de 26,6 mètres, laissant aux bateaux un passage large de 12,5 mètres. Des ponts fixes en béton armé seront aussi créés au sud du pont mobile, par-dessus les canaux de dessèchement.Approuvé par les deux assemblées départementales le 24 avril 1906, le projet est retardé par l'attente du soutien financier de l'Etat et par de nouvelles hésitations. Le 17 novembre 1906, une conférence mixte entre les deux départements définit la dimension du passage libre et les conditions d'emprunt du pont tournant placé sur l'écluse du canal de Marans à la mer. En février 1908, Lombard présente un nouvel avant-projet. Une autre conférence mixte, le 14 avril, scelle l'accord définitif entre les deux départements. Le projet est finalement déclaré d'utilité publique le 29 décembre 1909.La construction de la route ne commence toutefois qu'en mars 1911, celle des ponts en octobre, d'abord par celui sur le canal de la Brune. En mars 1912, l'entrepreneur, Abel Dodin, de Rochefort, se plaint de ne pas trouver les ouvriers nécessaires au chantier : ""Les quelques-uns qu'il a pu trouver ont abandonné le chantier. Ils ont été effrayés par la vase dans laquelle on est obligé de vivre"". La terre utilisée pour les remblais de la route, est prise dans les remblais du canal de Marans à la mer. En mai, la fabrication des pieux en béton armé du pont mobile se poursuit, avec le ciment Portland acheminé depuis l'usine de Mortagne-sur-Gironde, en Charente-Maritime, et le gravier des carrières de Coulon, dans les Deux-Sèvres. Une passerelle provisoire est établie en juin pour pouvoir procéder au battage des pieux du pont à l'aide d'une grande sonnette. Le battage commence le 10 juillet. Le 13 décembre, la construction du tablier métallique mobile est adjugée à l'entrepreneur J. Jeaudeau, de Marennes, atelier de serrurerie et de constructions en fer. En octobre 1913, sans attendre l'achèvement de la route, des essais de charge sont effectués sur les ponts. En mai 1914, le tablier métallique mobile est terminé. En juin, la réalisation d'une chaussée en macadam armé ""indéformable"", est adjugée à l'entreprise Genevière-Bonniot, de Saintes, mais celle-ci se rétracte en octobre, en raison de la guerre qui mobilise ses employés. La nouvelle route est finalement ouverte en janvier 1915.Détruit par les parachutistes français en 1944, reconstruit puis abandonné après la construction du nouveau pont mobile en 1977, l'ancien pont tournant est alors privé de son tablier central, interrompant de fait la communication entre les deux rives. La liaison est rétablie en septembre 2012, uniquement pour les piétons et les cyclistes, avec la construction d'une passerelle en métal par-dessus l'ancien ouvrage. Les travaux sont réalisés par le Département de la Charente-Maritime, avec un co-financement par celui de la Vendée."	Le pont mobile se trouve au milieu des marais, au point d'étranglement de l'anse du Brault (une bande de terre d'à peine plus de 70 mètres de large), au nord des portes ou écluses du même nom. Il assure la jonction entre deux axes routiers venant l'un de Vendée (rive droite, à l'ouest), l'autre de Charente-Maritime (rive gauche, à l'est). L'ouvrage, en béton armé, se compose de deux parties, appuyées sur chacune des deux rives et que reliait un tablier tournant. L'ensemble mesure plus de 100 mètres de long au total, avec une travée libre centrale de 12 mètres.		Yannis Suire	(c) Région Pays de la Loire - Inventaire général;(c) Conseil départemental de la Vendée			
IA72059144	Ponts sur la Braye, dits ponts Rouge et Blanc, rue Gambetta	pont	milieu 18e siècle	Bessé-sur-Braye	Sarthe	72035	72	0.7565443034003614	47.83201785153858				"Selon les registres paroissiaux de Bessé-sur-Braye, le grand pont sur la Braye fut construit en 1596 par la volonté du roi Henri IV et de Gilles de Souvré, seigneur de Courtanvaux. Le 17 mai, celui-ci en posait les premières pierres avec un représentant du roi, César Forget de Baudrye, trésorier général au bureau des finances de Tours. Parmi les personnalités présentes à la cérémonie, Nicolas de la Cordelle, ""maistre architecte et conducteur dudit œuvre"", et Charles Lasneau, sieur de Plainchamps, ""entrepreneur et adjudicatayre de la construction dudit pont"". L'ouvrage, baptisé pont Saint-Gilles, est entièrement en pierre de taille et possède un profil en dos d’âne et sept arches en plein cintre de taille décroissante vers les extrémités du pont. A l'hiver 1784-1785, deux des arches centrales sont emportées par une débâcle puis remplacées par un tablier en bois, selon la tradition peint en rouge, d'où l'appellation de ""pont Rouge"" que l'on retrouve dans les archives à partir des années 1830. Malgré cela, Julien-Rémy Pesche y voyait au début du XIXe siècle l’un des ponts les plus intéressants du département.L'entretien du pont Rouge est un souci constant de la municipalité de Bessé, afin que soit maintenues les communications avec Montoire et le Loir-et-Cher, et notamment le trafic des vins de la région du Loir et de la Touraine vers Saint-Calais et La Ferté-Bernard. Néanmoins, le financement des travaux est toujours l'objet de litiges avec l'administration et les différentes communes intéressées. En 1812, le conseil municipal indique que ""les arches du pont vieu [ont] besoin de réparations, plusieurs pierres de soutien sont carriées, il faudroit en substituer d'autres par sous-œuvre"". En 1818, la remise en état d'une arche menaçant de tomber est confiée au maçon Ferchaux. Une réfection de la section en bois dégradée par l’usure et de fortes pluies, par le charpentier Trottereau, est mentionnée vers 1820. En 1833, de nouveaux travaux sont adjugés aux sieurs Ferchaux et Habert, maîtres maçons à Bessé. Dans les années 1850, de nouvelles inquiétudes sont formulées sur une possible chute du tablier du pont. En 1864, les projets des commissaires voyers de Vendôme et de Saint-Calais sont soumis aux municipalités : le premier, prévoyant une coûteuse reconstruction, est rejeté, tandis que le second, se bornant à la restauration de la partie en bois, est finalement adopté et réalisé l'année suivante. Le pont fut semble-t-il reconstruit en 1937 : les culées et les piles en moellons et pierre de taille pourraient dater de cette période. Emporté en 1961 par une crue exceptionnelle de la Braye, de fréquence cinquantenaire, le tablier fut reconstruit en béton dans le 3e quart du XXe siècle.Le petit pont, dit pont Blanc, situé sur un bras secondaire, se fait beaucoup plus discret dans les archives et ses origines ne sont pas claires. Selon la monographie de Jeanine Lallemand et Jean Méry, il aurait été construit en 1754 en remplacement de plusieurs petites arches. Il devait également posséder un profil en dos d'âne, si bien qu'en 1880-1881, la commune demandait qu'il soit surbaissé afin de faciliter son franchissement, d'où son apparence actuelle."	Les deux ponts sur la Braye se trouvent à la sortie sud-est du bourg en direction de Montoire, de part et d’autre d’une île. Le plus grand, dit pont Rouge, est à cheval sur les communes de Bessé-sur-Braye et de Bonneveau, à la limite des départements de la Sarthe et du Loir-et-Cher, des régions Pays de la Loire et Centre-Val de Loire. Les culées et les deux piles à bec du grand pont (pont Rouge), en moellons et pierres de taille calcaire, sont celles d’un ouvrage antérieur, sur lesquelles a été posé un tablier en béton à garde-corps métallique. Le petit pont (pont Blanc), entièrement en pierre de taille, possède une seule arche en anse de panier. Tous deux sont reliés par une levée insubmersible maintenue par deux rangées d’arbres.		Pierrick Barreau	(c) Région Pays de la Loire - Inventaire général;(c) Pays du Perche sarthois	4e quart 19e siècle	2e quart 20e siècle	
IA72059009	Pont, rue du Gué-Hubert	pont	3e quart 19e siècle	Semur-en-Vallon	Sarthe	72333	72	0.6528708584239892	48.022347565740716			Deniau;Louis Touchard	"Le gué Hubert, dont la rue porte toujours le nom, permettait de franchir le ruisseau de la Longuève en sortant du bourg de Semur, en direction de Coudredieux. En 1862, il est décidé de construire un pont dit ""aqueduc à trois voies"" pour remplacer le gué et sa passerelle piétonne en bois, passage dangereux lors des fréquentes crues. Les plans et devis de l’ouvrage sont dressés par l’agent voyer cantonal Deniau et les travaux sont adjugés à Louis Touchard entrepreneur à Soulitré."	Le linteau de l’arche du pont sur la Longuève, en pierre de taille, repose sur deux piles aux extrémités arrondies. Le parapet est en brique et en pierre de taille.		Pierrick Barreau	(c) Région Pays de la Loire - Inventaire général;(c) Pays du Perche sarthois			
IA72058939	Pont, lavoir et abreuvoir communaux, rue de l'Étang	pont	Moyen Age	Tuffé Val de la Chéronne	Sarthe	72363	72	0.5197953308298018	48.114929777494275	Bourg de Tuffé Val de la Chéronne, rue de l'Étang			"Le cours de la Chéronne dans le bourg de Tuffé a été fortement contraint par les travaux hydrauliques des moines du prieuré, pour l’aménagement de leur moulin et de leurs étangs, et ce dès le XIIe siècle. Il est établi, au regard de plusieurs documents d’archives, du plan terrier du prieuré réalisé entre 1757 et 1759 et d’un dessin de 1827, que l’ancien grand étang des moines arrivait jusqu’au chemin de La Ferté-Bernard (actuelle rue de l’Étang). En témoigne la surélévation de la rue, formant une digue, la présence d’une ancienne bonde d’évacuation, ainsi que le pont lui-même. La datation de l’ouvrage, très frustre et sans doute régulièrement rafistolé, est malaisée. Aménagé par les moines, il accueillait entre ses arches les portes ou ""palles"" qui permettaient de vidanger le grand étang, alors semble-t-il surmontées de simples tabliers en bois. Cette fonction est confirmée par le plan terrier, mentionnant les ""portes de l’étang de Tuffé"", ainsi que des documents des années 1827-1832 relatives à l’édification de la maison de Louis Hérode devant les deux arches du pont (actuellement 3 rue de l’Étang). Sa construction avait causé une vive émotion parmi les riverains qui craignaient qu’elle ne génère de graves inondations telles qu’il s’en produisait lorsque le pont se trouvait obstrué. Il fut même suggéré que Hérode fasse percer une troisième arche à l’emplacement de la petite bonde, ce qui ne fut jamais réalisé. D’après une délibération municipale de 1832, André Bigot, nouveau propriétaire de la maison, aurait fait reconstruire en maçonnerie la terrasse reliant son logis au pont, alors en bois. Pour assurer la solidité de l’ensemble, il aurait également posé à ses frais les voûtes des arches du pont en remplacement des tabliers en bois.Au début du XIXe siècle déjà, l’ouvrage était flanqué d’un ancien lavoir et d’un abreuvoir plus ou moins à l’abandon, qu’il est question de remettre en état. Un cahier des charges des travaux, dressé en 1818 puis rayé, précise que l’abreuvoir et le lavoir devaient être reconstruits après avoir recreusé et nivelé le bassin et qu’un ""portereau"" en bois devait permettre de réguler le niveau de l’eau sans que celle-ci puisse refluer dans les prés en amont. Rien n’indique que les travaux furent bien réalisés, au contraire les demandes répétées de la municipalité semblent rester sans réponse. Le rétablissement du lavoir et de l’abreuvoir resurgit en 1841, mais malgré les relances répétées de la commune et de multiples devis, les travaux ne sont réalisés qu’en 1850. Le bâtiment est alors couvert en bardeau pour éviter que des tuiles ne soient cassées par les élèves de l’école de garçons voisine. En 1861, un barrage avec vanne mobile est aménagé en aval pour maintenir un niveau d’eau suffisant : il est rectifié en 1883 pour éviter l’inondation de propriétés riveraines. Le lavoir, qui  ne comprend alors qu’une aile (celle adossée au pont), est restauré et agrandi en 1893 d’une aile en retour : les travaux sont réalisés par Anatole Chevalier, maçon à Tuffé. En 1921, le lavoir est réparé, le déversoir cimenté et un nouvel empellement est mis en place."	Le pont, aménagé dans l’ancienne digue du grand étang, comprend deux arches segmentaires avec, à proximité, l’ancienne bonde de l’étang. Au nord, il est masqué par une maison construite sur l’emprise de l’ancien étang et dont la terrasse surplombe la Chéronne qui effectue un coude pour la contourner. Au sud, soutenu par un gros contrefort, il est flanqué du lavoir public et de l’ancien abreuvoir. Le lavoir, de plan en L, est couvert en appentis et repose sur des poteaux en bois sur plots maçonnés. On observe dans le mur de soutènement deux cavités, la première est une ancienne évacuation des eaux provenant du coteau, la seconde avec encadrement en brique pourrait l'avoir remplacée lorsque le lavoir fut agrandi et que la première se trouva condamnée. La bassin aujourd’hui cimenté servait également d’abreuvoir pour les animaux.		Pierrick Barreau	(c) Région Pays de la Loire - Inventaire général;(c) Pays du Perche sarthois	Temps modernes	2e quart 19e siècle	
IA72058900	Pont, route des Treize-Vents	pont	limite 16e siècle 17e siècle	Conflans-sur-Anille	Sarthe	72087	72	0.7456207644680932	47.94302126129927				"Avant la réalisation de la route actuelle entre Tours et La Ferté-Bernard, dans les années 1820, ce pont permettait le franchissement de l’Axone (ou Roule-Crottes) à quelques mètres de sa confluence avec l’Anille, sur le vieux chemin de Saint-Calais à La Ferté-Bernard. Dans sa monographie sur Conflans-sur-Anille, Louis Chéron en situe la construction vers 1600 à la suite d’un passage à gué. Aucun document permettant d’établir la date de construction de ce pont n’a été retrouvé, et l'analyse architecturale de cette ouvrage très rustique ne permet guère de s'avancer sur une datation précise. Toutefois, un ""pont de Conflans"" (bois ou pierre ?) est cité dès 1511 dans le cartulaire de l'abbaye de Saint-Calais, et le ""pont en pierre de Conflans"" est mentionné dans un aveu du seigneur de la Barre au duché de Vendôme en 1609. Ainsi, une réalisation à la fin du XVIe ou au début du XVIIe siècle, voire antérieurement, reste plausible. Lorsque fut levé le plan cadastral napoléonien de 1829, c'était le seul véritable pont du bourg. En 1801, il est question de travaux dans les délibérations municipales, mais on trouve également mention d’un devis pour la construction d’un pont en bas du bourg en 1823, qui pourrait aussi bien correspondre au pont actuel. Le plan d’alignement de 1872 mentionne un petit lavoir contigu au pont, probablement privé, aujourd’hui disparu."	Le pont, construit en moellons, comprend une unique arche en pierre, en anse de panier. L’arc est formé de larges pierres plates posées à la verticale les unes contre les autres. Il enjambe le ruisseau Axone dit aussi Roulecrotte.		Pierrick Barreau	(c) Région Pays de la Loire - Inventaire général;(c) Pays du Perche sarthois	1er quart 19e siècle		
